{
  "schema_id": "wwo_economic_geography_sector_catalog_v1",
  "schema_version": 1,
  "catalog_notice": "Sector identities are an evidence vocabulary, not mutable runtime industries or capacities.",
  "sectors": [
    {"sector_id": "coal_mining", "sector_group": "extraction", "label": "Coal mining"},
    {"sector_id": "iron_ore_mining", "sector_group": "extraction", "label": "Iron-ore mining"},
    {"sector_id": "copper_mining", "sector_group": "extraction", "label": "Copper mining and smelting feedstock"},
    {"sector_id": "petroleum_extraction", "sector_group": "extraction", "label": "Petroleum extraction"},
    {"sector_id": "timber_extraction", "sector_group": "extraction", "label": "Timber extraction"},
    {"sector_id": "quarrying", "sector_group": "extraction", "label": "Stone, limestone, and quarrying"},
    {"sector_id": "grain_farming", "sector_group": "agriculture", "label": "Grain farming"},
    {"sector_id": "rice_farming", "sector_group": "agriculture", "label": "Rice farming"},
    {"sector_id": "jute_farming", "sector_group": "agriculture", "label": "Jute farming"},
    {"sector_id": "cotton_farming", "sector_group": "agriculture", "label": "Cotton farming"},
    {"sector_id": "tea_cultivation", "sector_group": "agriculture", "label": "Tea cultivation"},
    {"sector_id": "silk_rearing", "sector_group": "agriculture", "label": "Silk rearing and raw-silk supply"},
    {"sector_id": "coke_production", "sector_group": "heavy_industry", "label": "Coke production"},
    {"sector_id": "pig_iron", "sector_group": "heavy_industry", "label": "Pig-iron production"},
    {"sector_id": "steelmaking", "sector_group": "heavy_industry", "label": "Steelmaking"},
    {"sector_id": "cotton_textiles", "sector_group": "manufacturing", "label": "Cotton spinning and textiles"},
    {"sector_id": "wool_textiles", "sector_group": "manufacturing", "label": "Wool and worsted textiles"},
    {"sector_id": "jute_textiles", "sector_group": "manufacturing", "label": "Jute milling and jute textiles"},
    {"sector_id": "silk_textiles", "sector_group": "manufacturing", "label": "Silk reeling and silk textiles"},
    {"sector_id": "machinery", "sector_group": "manufacturing", "label": "Machinery and industrial equipment"},
    {"sector_id": "food_processing", "sector_group": "manufacturing", "label": "Food processing and milling"},
    {"sector_id": "shipbuilding", "sector_group": "manufacturing", "label": "Shipbuilding and ship repair"},
    {"sector_id": "copper_smelting", "sector_group": "manufacturing", "label": "Copper smelting"},
    {"sector_id": "tinplate", "sector_group": "manufacturing", "label": "Tinplate production"},
    {"sector_id": "port_handling", "sector_group": "infrastructure", "label": "Port handling and transshipment"},
    {"sector_id": "rail_freight", "sector_group": "infrastructure", "label": "Rail freight connection"},
    {"sector_id": "river_transport", "sector_group": "infrastructure", "label": "River and canal transport"}
  ]
}
